code,name
A ,"СІЛЬСЬКЕ ГОСПОДАРСТВО, ЛІСОВЕ ГОСПОДАРСТВО ТА РИБНЕ ГОСПОДАРСТВО "
01 ,"Сільське господарство, мисливство та надання пов'язаних із ними послуг "
01.1 ,Вирощування однорічних і дворічних культур 
01.11 ,"Вирощування зернових культур (крім рису), бобових культур і насіння олійних культур "
01.12 ,Вирощування рису 
01.13 ,"Вирощування овочів і баштанних культур, коренеплодів і бульбоплодів "
01.14 ,Вирощування цукрової тростини 
01.15 ,Вирощування тютюну 
01.16 ,Вирощування прядивних культур 
01.19 ,Вирощування інших однорічних і дворічних культур 
01.2 ,Вирощування багаторічних культур 
01.21 ,Вирощування винограду 
01.22 ,Вирощування тропічних і субтропічних фруктів 
01.23 ,Вирощування цитрусових 
01.24 ,Вирощування зерняткових і кісточкових фруктів 
01.25 ,"Вирощування ягід, горіхів, інших фруктів"
01.26 ,Вирощування олійних плодів 
01.27 ,Вирощування культур для виробництва напоїв 
01.28 ,"Вирощування пряних, ароматичних і лікарських культур "
01.29 ,Вирощування інших багаторічних культур 
01.3 ,Відтворення рослин 
01.30 ,Відтворення рослин 
01.4 ,Тваринництво 
01.41 ,Розведення великої рогатої худоби молочних порід 
01.42 ,Розведення іншої великої рогатої худоби та буйволів 
01.43 ,Розведення коней та інших тварин родини конячих 
01.44 ,Розведення верблюдів та інших тварин родини верблюдячих 
01.45 ,Розведення овець і кіз 
01.46 ,Розведення свиней 
01.47 ,Розведення свійської птиці 
01.49 ,Розведення інших тварин 
01.5 ,Змішане сільське господарство 
01.50 ,Змішане сільське господарство 
01.6 ,Допоміжна діяльність у сільському господарстві та післяурожайна діяльність 
01.61 ,Допоміжна діяльність у рослинництві 
01.62 ,Допоміжна діяльність у тваринництві 
01.63 ,Післяурожайна діяльність 
01.64 ,Оброблення насіння для відтворення 
01.7 ,"Мисливство, відловлювання тварин і надання пов'язаних із ними послуг "
01.70 ,"Мисливство, відловлювання тварин і надання пов'язаних із ними послуг "
02 ,Лісове господарство та лісозаготівлі 
02.1 ,Лісівництво та інша діяльність у лісовому господарстві 
02.10 ,Лісівництво та інша діяльність у лісовому господарстві 
02.2 ,Лісозаготівлі 
02.20 ,Лісозаготівлі 
02.3 ,Збирання дикорослих недеревних продуктів 
02.30 ,Збирання дикорослих недеревних продуктів 
02.4 ,Надання допоміжних послуг у лісовому господарстві 
02.40 ,Надання допоміжних послуг у лісовому господарстві 
03 ,Рибне господарство 
03.1 ,Рибальство 
03.11 ,Морське рибальство 
03.12 ,Прісноводне рибальство 
03.2 ,Рибництво (аквакультура) 
03.21 ,Морське рибництво (аквакультура) 
03.22 ,Прісноводне рибництво (аквакультура) 
B ,ДОБУВНА ПРОМИСЛОВІСТЬ І РОЗРОБЛЕННЯ КАР'ЄРІВ 
05 ,Добування кам'яного та бурого вугілля 
05.1 ,Добування кам'яного вугілля 
05.10 ,Добування кам'яного вугілля 
05.2 ,Добування бурого вугілля 
05.20 ,Добування бурого вугілля 
06 ,Добування сирої нафти та природного газу 
06.1 ,Добування сирої нафти 
06.10 ,Добування сирої нафти 
06.2 ,Добування природного газу 
06.20 ,Добування природного газу 
07 ,Добування металевих руд 
07.1 ,Добування залізних руд 
07.10 ,Добування залізних руд 
07.2 ,Добування руд кольорових металів 
07.21 ,Добування уранових і торієвих руд 
07.29 ,Добування руд інших кольорових металів 
08 ,Добування інших корисних копалин і розроблення кар'єрів 
08.1 ,"Добування каменю, піску та глини "
08.11 ,"Добування декоративного та будівельного каменю, вапняку, гіпсу, крейди та глинистого сланцю "
08.12 ,"Добування піску, гравію, глин і каоліну "
08.9 ,"Добування корисних копалин і розроблення кар'єрів, н. в. і. у. "
08.91 ,Добування мінеральної сировини для хімічної промисловості та виробництва мінеральних добрив 
08.92 ,Добування торфу 
08.93 ,Добування солі 
08.99 ,"Добування інших корисних копалин і розроблення кар'єрів, н. в. і. у. "
09 ,Надання допоміжних послуг у сфері добувної промисловості та розроблення кар'єрів 
09.1 ,Надання допоміжних послуг у сфері добування нафти та природного газу 
09.10 ,Надання допоміжних послуг у сфері добування нафти та природного газу 
09.9 ,Надання допоміжних послуг у сфері добування інших корисних копалин і розроблення кар'єрів 
09.90 ,Надання допоміжних послуг у сфері добування інших корисних копалин і розроблення кар'єрів 
C ,ПЕРЕРОБНА ПРОМИСЛОВІСТЬ 
10 ,Виробництво харчових продуктів 
10.1 ,Виробництво м'яса та м'ясних продуктів 
10.11 ,Виробництво м'яса 
10.12 ,Виробництво м'яса свійської птиці 
10.13 ,Виробництво м'ясних продуктів 
10.2 ,"Перероблення та консервування риби, ракоподібних і молюсків "
10.20 ,"Перероблення та консервування риби, ракоподібних і молюсків "
10.3 ,Перероблення та консервування фруктів і овочів 
10.31 ,Перероблення та консервування картоплі 
10.32 ,Виробництво фруктових і овочевих соків 
10.39 ,Інші види перероблення та консервування фруктів і овочів 
10.4 ,Виробництво олії та тваринних жирів 
10.41 ,Виробництво олії та тваринних жирів 
10.42 ,Виробництво маргарину і подібних харчових жирів 
10.5 ,Виробництво молочних продуктів 
10.51 ,"Перероблення молока, виробництво масла та сиру "
10.52 ,Виробництво морозива 
10.6 ,"Виробництво продуктів борошномельно-круп'яної промисловості, крохмалів і крохмальних продуктів "
10.61 ,Виробництво продуктів борошномельно-круп'яної промисловості 
10.62 ,Виробництво крохмалів і крохмальних продуктів 
10.7 ,"Виробництво хліба, хлібобулочних і борошняних виробів "
10.71 ,"Виробництво хліба та хлібобулочних виробів; виробництво борошняних кондитерських виробів, тортів і тістечок нетривалого зберігання "
10.72 ,"Виробництво сухарів і сухого печива; виробництво борошняних кондитерських виробів, тортів і тістечок тривалого зберігання "
10.73 ,Виробництво макаронних виробів і подібних борошняних виробів 
10.8 ,Виробництво інших харчових продуктів 
10.81 ,Виробництво цукру 
10.82 ,"Виробництво какао, шоколаду та цукрових кондитерських виробів "
10.83 ,Виробництво чаю та кави 
10.84 ,Виробництво прянощів і приправ 
10.85 ,Виробництво готової їжі та страв 
10.86 ,Виробництво дитячого харчування та дієтичних харчових продуктів 
10.89 ,"Виробництво інших харчових продуктів, н. в. і. у."
10.9 ,Виробництво готових кормів для тварин 
10.91 ,"Виробництво готових кормів для тварин, що утримуються на фермах "
10.92 ,Виробництво готових кормів для домашніх тварин 
11 ,Виробництво напоїв 
11.0 ,Виробництво напоїв 
11.01 ,"Дистиляція, ректифікація та змішування алкогольних напоїв "
11.02 ,Виробництво виноградних вин 
11.03 ,Виробництво сидру та інших плодово-ягідних вин 
11.04 ,Виробництво інших недистильованих напоїв із зброджуваних продуктів 
11.05 ,Виробництво пива 
11.06 ,Виробництво солоду 
11.07 ,"Виробництво безалкогольних напоїв; виробництво мінеральних вод та інших вод, розлитих у пляшки "
12 ,Виробництво тютюнових виробів 
12.0 ,Виробництво тютюнових виробів 
12.00 ,Виробництво тютюнових виробів 
13 ,Текстильне виробництво 
13.1 ,Підготування та прядіння текстильних волокон 
13.10 ,Підготування та прядіння текстильних волокон 
13.2 ,Ткацьке виробництво 
13.20 ,Ткацьке виробництво 
13.3 ,Оздоблення текстильних виробів 
13.30 ,Оздоблення текстильних виробів 
13.9 ,Виробництво інших текстильних виробів 
13.91 ,Виробництво трикотажного полотна 
13.92 ,"Виробництво готових текстильних виробів, крім одягу "
13.93 ,Виробництво килимів і килимових виробів 
13.94 ,"Виробництво канатів, мотузок, шпагату та сіток "
13.95 ,"Виробництво нетканих текстильних матеріалів і виробів із них, крім одягу "
13.96 ,Виробництво інших текстильних виробів технічного та промислового призначення 
13.99 ,"Виробництво інших текстильних виробів, н. в. і. у. "
14 ,Виробництво одягу 
14.1 ,"Виробництво одягу, крім хутряного "
14.11 ,Виробництво одягу зі шкіри 
14.12 ,Виробництво робочого одягу 
14.13 ,Виробництво іншого верхнього одягу 
14.14 ,Виробництво спіднього одягу 
14.19 ,Виробництво іншого одягу й аксесуарів 
14.2 ,Виготовлення виробів із хутра 
14.20 ,Виготовлення виробів із хутра 
14.3 ,Виробництво трикотажного та в'язаного одягу 
14.31 ,Виробництво панчішно-шкарпеткових виробів 
14.39 ,Виробництво іншого трикотажного та в'язаного одягу 
15 ,"Виробництво шкіри, виробів зі шкіри та інших матеріалів "
15.1 ,"Дублення шкур і оздоблення шкіри; виробництво дорожніх виробів, сумок, лимарно-сідельних виробів; вичинка та фарбування хутра "
15.11 ,Дублення шкур і оздоблення шкіри; вичинка та фарбування хутра 
15.12 ,"Виробництво дорожніх виробів, сумок, лимарно-сідельних виробів зі шкіри та інших матеріалів "
15.2 ,Виробництво взуття 
15.20 ,Виробництво взуття 
16 ,"Оброблення деревини та виготовлення виробів з деревини та корка, крім меблів; виготовлення виробів із соломки та рослинних матеріалів для плетіння "
16.1 ,Лісопильне та стругальне виробництво 
16.10 ,Лісопильне та стругальне виробництво 
16.2 ,"Виготовлення виробів з деревини, корка, соломки та рослинних матеріалів для плетіння "
16.21 ,"Виробництво фанери, дерев'яних плит і панелей, шпону "
16.22 ,Виробництво щитового паркету 
16.23 ,Виробництво інших дерев'яних будівельних конструкцій і столярних виробів 
16.24 ,Виробництво дерев'яної тари 
16.29 ,"Виробництво інших виробів з деревини; виготовлення виробів з корка, соломки та рослинних матеріалів для плетіння "
17 ,Виробництво паперу та паперових виробів 
17.1 ,"Виробництво паперової маси, паперу та картону "
17.11 ,Виробництво паперової маси 
17.12 ,Виробництво паперу та картону 
17.2 ,Виготовлення виробів з паперу та картону 
17.21 ,"Виробництво гофрованого паперу та картону, паперової та картонної тари "
17.22 ,Виробництво паперових виробів господарсько-побутового та санітарно-гігієнічного призначення 
17.23 ,Виробництво паперових канцелярських виробів 
17.24 ,Виробництво шпалер 
17.29 ,Виробництво інших виробів з паперу та картону 
18 ,"Поліграфічна діяльність, тиражування записаної інформації "
18.1 ,Поліграфічна діяльність і надання пов'язаних із нею послуг 
18.11 ,Друкування газет 
18.12 ,Друкування іншої продукції 
18.13 ,Виготовлення друкарських форм і надання інших поліграфічних послуг 
18.14 ,Брошурувально-палітурна діяльність і надання пов'язаних із нею послуг 
18.2 ,"Тиражування звуко-, відеозаписів і програмного забезпечення "
18.20 ,"Тиражування звуко-, відеозаписів і програмного забезпечення "
19 ,Виробництво коксу та продуктів нафтоперероблення 
19.1 ,Виробництво коксу та коксопродуктів 
19.10 ,Виробництво коксу та коксопродуктів 
19.2 ,Виробництво продуктів нафтоперероблення 
19.20 ,Виробництво продуктів нафтоперероблення 
20 ,Виробництво хімічних речовин і хімічної продукції 
20.1 ,"Виробництво основної хімічної продукції, добрив і азотних сполук, пластмас і синтетичного каучуку в первинних формах "
20.11 ,Виробництво промислових газів 
20.12 ,Виробництво барвників і пігментів 
20.13 ,Виробництво інших основних неорганічних хімічних речовин 
20.14 ,Виробництво інших основних органічних хімічних речовин 
20.15 ,Виробництво добрив і азотних сполук 
20.16 ,Виробництво пластмас у первинних формах 
20.17 ,Виробництво синтетичного каучуку в первинних формах 
20.2 ,Виробництво пестицидів та іншої агрохімічної продукції 
20.20 ,Виробництво пестицидів та іншої агрохімічної продукції 
20.3 ,"Виробництво фарб, лаків і подібної продукції, друкарської фарби та мастик "
20.30 ,"Виробництво фарб, лаків і подібної продукції, друкарської фарби та мастик "
20.4 ,"Виробництво мила та мийних засобів, засобів для чищення та полірування, парфумних і косметичних засобів "
20.41 ,"Виробництво мила та мийних засобів, засобів для чищення та полірування "
20.42 ,Виробництво парфумних і косметичних засобів 
20.5 ,Виробництво іншої хімічної продукції 
20.51 ,Виробництво вибухових речовин 
20.52 ,Виробництво клеїв 
20.53 ,Виробництво ефірних олій 
20.59 ,"Виробництво іншої хімічної продукції, н. в. і. у. "
20.6 ,Виробництво штучних і синтетичних волокон 
20.60 ,Виробництво штучних і синтетичних волокон 
21 ,Виробництво основних фармацевтичних продуктів і фармацевтичних препаратів 
21.1 ,Виробництво основних фармацевтичних продуктів 
21.10 ,Виробництво основних фармацевтичних продуктів 
21.2 ,Виробництво фармацевтичних препаратів і матеріалів 
21.20 ,Виробництво фармацевтичних препаратів і матеріалів 
22 ,Виробництво гумових і пластмасових виробів 
22.1 ,Виробництво гумових виробів 
22.11 ,"Виробництво гумових шин, покришок і камер; відновлення протектора гумових шин і покришок "
22.19 ,Виробництво інших гумових виробів 
22.2 ,Виробництво пластмасових виробів 
22.21 ,"Виробництво плит, листів, труб і профілів із пластмас "
22.22 ,Виробництво тари з пластмас 
22.23 ,Виробництво будівельних виробів із пластмас 
22.29 ,Виробництво інших виробів із пластмас 
23 ,Виробництво іншої неметалевої мінеральної продукції 
23.1 ,Виробництво скла та виробів зі скла 
23.11 ,Виробництво листового скла 
23.12 ,Формування й оброблення листового скла 
23.13 ,Виробництво порожнистого скла 
23.14 ,Виробництво скловолокна 
23.19 ,"Виробництво й оброблення інших скляних виробів, у тому числі технічних "
23.2 ,Виробництво вогнетривких виробів 
23.20 ,Виробництво вогнетривких виробів 
23.3 ,Виробництво будівельних матеріалів із глини 
23.31 ,Виробництво керамічних плиток і плит 
23.32 ,"Виробництво цегли, черепиці та інших будівельних виробів із випаленої глини "
23.4 ,Виробництво іншої продукції з фарфору та кераміки 
23.41 ,Виробництво господарських і декоративних керамічних виробів 
23.42 ,Виробництво керамічних санітарно-технічних виробів 
23.43 ,Виробництво керамічних електроізоляторів та ізоляційної арматури 
23.44 ,Виробництво інших керамічних виробів технічного призначення 
23.49 ,Виробництво інших керамічних виробів 
23.5 ,"Виробництво цементу, вапна та гіпсових сумішей "
23.51 ,Виробництво цементу 
23.52 ,Виробництво вапна та гіпсових сумішей 
23.6 ,"Виготовлення виробів із бетону, гіпсу та цементу "
23.61 ,Виготовлення виробів із бетону для будівництва 
23.62 ,Виготовлення виробів із гіпсу для будівництва 
23.63 ,"Виробництво бетонних розчинів, готових для використання "
23.64 ,Виробництво сухих будівельних сумішей 
23.65 ,Виготовлення виробів із волокнистого цементу 
23.69 ,Виробництво інших виробів із бетону гіпсу та цементу 
23.7 ,"Різання, оброблення та оздоблення декоративного та будівельного каменю "
23.70 ,"Різання, оброблення та оздоблення декоративного та будівельного каменю "
23.9 ,"Виробництво абразивних виробів і неметалевих мінеральних виробів, н. в. і. у. "
23.91 ,Виробництво абразивних виробів 
23.99 ,"Виробництво неметалевих мінеральних виробів, н. в. і. у. "
24 ,Металургійне виробництво 
24.1 ,"Виробництво чавуну, сталі та феросплавів "
24.10 ,Виробництво чавуну сталі та феросплавів 
24.2 ,"Виробництво труб, порожнистих профілів і фітингів зі сталі "
24.20 ,"Виробництво труб, порожнистих профілів і фітингів зі сталі "
