code,name
46.17 ,"Діяльність посередників у торгівлі продуктами харчування, напоями та тютюновими виробами "
46.18 ,"Діяльність посередників, що спеціалізуються в торгівлі іншими товарами "
46.19 ,Діяльність посередників у торгівлі товарами широкого асортименту 
46.2 ,Оптова торгівля сільськогосподарською сировиною та живими тваринами 
46.21 ,"Оптова торгівля зерном, необробленим тютюном, насінням і кормами для тварин "
46.22 ,Оптова торгівля квітами та рослинами 
46.23 ,Оптова торгівля живими тваринами 
46.24 ,"Оптова торгівля шкірсировиною, шкурами та шкірою "
46.3 ,"Оптова торгівля продуктами харчування, напоями та тютюновими виробами "
46.31 ,Оптова торгівля фруктами й овочами 
46.32 ,Оптова торгівля м'ясом і м'ясними продуктами 
46.33 ,"Оптова торгівля молочними продуктами, яйцями, харчовими оліями та жирами "
46.34 ,Оптова торгівля напоями 
46.35 ,Оптова торгівля тютюновими виробами 
46.36 ,"Оптова торгівля цукром, шоколадом і кондитерськими виробами "
46.37 ,"Оптова торгівля кавою, чаєм, какао та прянощами "
46.38 ,"Оптова торгівля іншими продуктами харчування, у тому числі рибою, ракоподібними та молюсками "
46.39 ,"Неспеціалізована оптова торгівля продуктами харчування, напоями та тютюновими виробами "
46.4 ,Оптова торгівля товарами господарського призначення 
46.41 ,Оптова торгівля текстильними товарами 
46.42 ,Оптова торгівля одягом і взуттям 
46.43 ,"Оптова торгівля побутовими електротоварами й електронною апаратурою побутового призначення для приймання, записування, відтворювання звуку й зображення "
46.44 ,"Оптова торгівля фарфором, скляним посудом і засобами для чищення "
46.45 ,Оптова торгівля парфумними та косметичними товарами 
46.46 ,Оптова торгівля фармацевтичними товарами 
46.47 ,"Оптова торгівля меблями, килимами й освітлювальним приладдям "
46.48 ,Оптова торгівля годинниками та ювелірними виробами 
46.49 ,Оптова торгівля іншими товарами господарського призначення 
46.5 ,Оптова торгівля інформаційним і комунікаційним устаткованням 
46.51 ,"Оптова торгівля комп'ютерами, периферійним устаткованням і програмним забезпеченням "
46.52 ,"Оптова торгівля електронним і телекомунікаційним устаткованням, деталями до нього "
46.6 ,Оптова торгівля іншими машинами й устаткованням 
46.61 ,Оптова торгівля сільськогосподарськими машинами й устаткованням 
46.62 ,Оптова торгівля верстатами 
46.63 ,Оптова торгівля машинами й устаткованням для добувної промисловості та будівництва 
46.64 ,"Оптова торгівля машинами й устаткованням для текстильного, швейного та трикотажного виробництва "
46.65 ,Оптова торгівля офісними меблями 
46.66 ,Оптова торгівля іншими офісними машинами й устаткованням 
46.69 ,Оптова торгівля іншими машинами й устаткованням 
46.7 ,Інші види спеціалізованої оптової торгівлі 
46.71 ,"Оптова торгівля твердим, рідким, газоподібним паливом і подібними продуктами "
46.72 ,Оптова торгівля металами та металевими рудами 
46.73 ,"Оптова торгівля деревиною, будівельними матеріалами та санітарно-технічним обладнанням "
46.74 ,"Оптова торгівля залізними виробами, водопровідним і опалювальним устаткованням і приладдям до нього "
46.75 ,Оптова торгівля хімічними продуктами 
46.76 ,Оптова торгівля іншими проміжними продуктами 
46.77 ,Оптова торгівля відходами та брухтом 
46.9 ,Неспеціалізована оптова торгівля 
46.90 ,Неспеціалізована оптова торгівля 
47 ,"Роздрібна торгівля, крім торгівлі автотранспортними засобами та мотоциклами "
47.1 ,Роздрібна торгівля в неспеціалізованих магазинах 
47.11 ,"Роздрібна торгівля в неспеціалізованих магазинах переважно продуктами харчування, напоями та тютюновими виробами "
47.19 ,Інші види роздрібної торгівлі в неспеціалізованих магазинах 
47.2 ,"Роздрібна торгівля продуктами харчування, напоями та тютюновими виробами в спеціалізованих магазинах "
47.21 ,Роздрібна торгівля фруктами й овочами в спеціалізованих магазинах 
47.22 ,Роздрібна торгівля м'ясом і м'ясними продуктами в спеціалізованих магазинах 
47.23 ,"Роздрібна торгівля рибою, ракоподібними та молюсками в спеціалізованих магазинах "
47.24 ,"Роздрібна торгівля хлібобулочними виробами, борошняними та цукровими кондитерськими виробами в спеціалізованих магазинах "
47.25 ,Роздрібна торгівля напоями в спеціалізованих магазинах 
47.26 ,Роздрібна торгівля тютюновими виробами в спеціалізованих магазинах 
47.29 ,Роздрібна торгівля іншими продуктами харчування в спеціалізованих магазинах 
47.3 ,Роздрібна торгівля пальним 
47.30 ,Роздрібна торгівля пальним 
47.4 ,Роздрібна торгівля інформаційним і комунікаційним устаткованням у спеціалізованих магазинах 
47.41 ,"Роздрібна торгівля комп'ютерами, периферійним устаткованням і програмним забезпеченням у спеціалізованих магазинах "
47.42 ,Роздрібна торгівля телекомунікаційним устаткованням у спеціалізованих магазинах 
47.43 ,"Роздрібна торгівля в спеціалізованих магазинах електронною апаратурою побутового призначення для приймання, записування, відтворення звуку й зображення "
47.5 ,Роздрібна торгівля іншими товарами господарського призначення в спеціалізованих магазинах 
47.51 ,Роздрібна торгівля текстильними товарами в спеціалізованих магазинах 
47.52 ,"Роздрібна торгівля залізними виробами, будівельними матеріалами та санітарно-технічними виробами в спеціалізованих магазинах "
47.53 ,"Роздрібна торгівля килимами, килимовими виробами, покриттям для стін і підлоги в спеціалізованих магазинах "
47.54 ,Роздрібна торгівля побутовими електротоварами в спеціалізованих магазинах 
47.59 ,"Роздрібна торгівля меблями, освітлювальним приладдям та іншими товарами для дому в спеціалізованих магазинах "
47.6 ,Роздрібна торгівля товарами культурного призначення та товарами для відпочинку в спеціалізованих магазинах 
47.61 ,Роздрібна торгівля книгами в спеціалізованих магазинах 
47.62 ,Роздрібна торгівля газетами та канцелярськими товарами в спеціалізованих магазинах 
47.63 ,Роздрібна торгівля аудіо- та відеозаписами в спеціалізованих магазинах 
47.64 ,Роздрібна торгівля спортивним інвентарем у спеціалізованих магазинах 
47.65 ,Роздрібна торгівля іграми та іграшками в спеціалізованих магазинах 
47.7 ,Роздрібна торгівля іншими товарами в спеціалізованих магазинах 
47.71 ,Роздрібна торгівля одягом у спеціалізованих магазинах 
47.72 ,Роздрібна торгівля взуттям і шкіряними виробами в спеціалізованих магазинах 
47.73 ,Роздрібна торгівля фармацевтичними товарами в спеціалізованих магазинах 
47.74 ,Роздрібна торгівля медичними й ортопедичними товарами в спеціалізованих магазинах 
47.75 ,Роздрібна торгівля косметичними товарами та туалетними приналежностями в спеціалізованих магазинах 
47.76 ,"Роздрібна торгівля квітами, рослинами, насінням, добривами, домашніми тваринами та кормами для них у спеціалізованих магазинах "
47.77 ,Роздрібна торгівля годинниками та ювелірними виробами в спеціалізованих магазинах 
47.78 ,Роздрібна торгівля іншими невживаними товарами в спеціалізованих магазинах 
47.79 ,Роздрібна торгівля уживаними товарами в магазинах 
47.8 ,Роздрібна торгівля з лотків і на ринках 
47.81 ,"Роздрібна торгівля з лотків і на ринках харчовими продуктами, напоями та тютюновими виробами "
47.82 ,"Роздрібна торгівля з лотків і на ринках текстильними виробами, одягом і взуттям "
47.89 ,Роздрібна торгівля з лотків і на ринках іншими товарами 
47.9 ,Роздрібна торгівля поза магазинами 
47.91 ,"Роздрібна торгівля, що здійснюється фірмами поштового замовлення або через мережу Інтернет "
47.99 ,Інші види роздрібної торгівлі поза магазинами 
H ,"ТРАНСПОРТ, СКЛАДСЬКЕ ГОСПОДАРСТВО, ПОШТОВА ТА КУР'ЄРСЬКА ДІЯЛЬНІСТЬ "
49 ,Наземний і трубопровідний транспорт 
49.1 ,Пасажирський залізничний транспорт міжміського сполучення 
49.10 ,Пасажирський залізничний транспорт міжміського сполучення 
49.2 ,Вантажний залізничний транспорт 
49.20 ,Вантажний залізничний транспорт 
49.3 ,Інший пасажирський наземний транспорт 
49.31 ,Пасажирський наземний транспорт міського та приміського сполучення 
49.32 ,Надання послуг таксі 
49.39 ,"Інший пасажирський наземний транспорт, н. в. і. у. "
49.4 ,"Вантажний автомобільний транспорт, надання послуг перевезення речей "
49.41 ,Вантажний автомобільний транспорт 
49.42 ,Надання послуг перевезення речей (переїзду) 
49.5 ,Трубопровідний транспорт 
49.50 ,Трубопровідний транспорт 
50 ,Водний транспорт 
50.1 ,Пасажирський морський транспорт 
50.10 ,Пасажирський морський транспорт 
50.2 ,Вантажний морський транспорт 
50.20 ,Вантажний морський транспорт 
50.3 ,Пасажирський річковий транспорт 
50.30 ,Пасажирський річковий транспорт 
50.4 ,Вантажний річковий транспорт 
50.40 ,Вантажний річковий транспорт 
51 ,Авіаційний транспорт 
51.1 ,Пасажирський авіаційний транспорт 
51.10 ,Пасажирський авіаційний транспорт 
51.2 ,Вантажний авіаційний транспорт і космічний транспорт 
51.21 ,Вантажний авіаційний транспорт 
51.22 ,Космічний транспорт 
52 ,Складське господарство та допоміжна діяльність у сфері транспорту 
52.1 ,Складське господарство 
52.10 ,Складське господарство 
52.2 ,Допоміжна діяльність у сфері транспорту 
52.21 ,Допоміжне обслуговування наземного транспорту 
52.22 ,Допоміжне обслуговування водного транспорту 
52.23 ,Допоміжне обслуговування авіаційного транспорту 
52.24 ,Транспортне оброблення вантажів 
52.29 ,Інша допоміжна діяльність у сфері транспорту 
53 ,Поштова та кур'єрська діяльність 
53.1 ,Діяльність національної пошти 
53.10 ,Діяльність національної пошти 
53.2 ,Інша поштова та кур'єрська діяльність 
53.20 ,Інша поштова та кур'єрська діяльність 
I ,ТИМЧАСОВЕ РОЗМІЩУВАННЯ Й ОРГАНІЗАЦІЯ ХАРЧУВАННЯ 
55 ,Тимчасове розміщування 
55.1 ,Діяльність готелів і подібних засобів тимчасового розміщування 
55.10 ,Діяльність готелів і подібних засобів тимчасового розміщування 
55.2 ,Діяльність засобів розміщування на період відпустки та іншого тимчасового проживання 
55.20 ,Діяльність засобів розміщування на період відпустки та іншого тимчасового проживання 
55.3 ,Надання місць кемпінгами та стоянками для житлових автофургонів і причепів 
55.30 ,Надання місць кемпінгами та стоянками для житлових автофургонів і причепів 
55.9 ,Діяльність інших засобів тимчасового розміщування 
55.90 ,Діяльність інших засобів тимчасового розміщування 
56 ,Діяльність із забезпечення стравами та напоями 
56.1 ,"Діяльність ресторанів, надання послуг мобільного харчування "
56.10 ,"Діяльність ресторанів, надання послуг мобільного харчування "
56.2 ,Постачання готових страв 
56.21 ,Постачання готових страв для подій 
56.29 ,Постачання інших готових страв 
56.3 ,Обслуговування напоями 
56.30 ,Обслуговування напоями 
J ,ІНФОРМАЦІЯ ТА ТЕЛЕКОМУНІКАЦІЇ 
58 ,Видавнича діяльність 
58.1 ,"Видання книг, періодичних видань та інша видавнича діяльність "
58.11 ,Видання книг 
58.12 ,Видання довідників і каталогів 
58.13 ,Видання газет 
58.14 ,Видання журналів і періодичних видань 
58.19 ,Інші види видавничої діяльності 
58.2 ,Видання програмного забезпечення 
58.21 ,Видання комп'ютерних ігор 
58.29 ,Видання іншого програмного забезпечення 
59 ,"Виробництво кіно-та відеофільмів, телевізійних програм, видання звукозаписів "
59.1 ,"Виробництво кіно- та відеофільмів, телевізійних програм "
59.11 ,"Виробництво кіно- та відеофільмів, телевізійних програм "
59.12 ,"Компонування кіно- та відеофільмів, телевізійних програм "
59.13 ,"Розповсюдження кіно- та відеофільмів, телевізійних програм "
59.14 ,Демонстрація кінофільмів 
59.2 ,Видання звукозаписів 
59.20 ,Видання звукозаписів 
60 ,Діяльність у сфері радіомовлення та телевізійного мовлення 
60.1 ,Діяльність у сфері радіомовлення 
60.10 ,Діяльність у сфері радіомовлення 
60.2 ,Діяльність у сфері телевізійного мовлення 
60.20 ,Діяльність у сфері телевізійного мовлення 
61 ,Телекомунікації (електрозв'язок) 
61.1 ,Діяльність у сфері проводового електрозв'язку 
61.10 ,Діяльність у сфері проводового електрозв'язку 
61.2 ,Діяльність у сфері безпроводового електрозв'язку 
61.20 ,Діяльність у сфері безпроводового електрозв'язку 
61.3 ,Діяльність у сфері супутникового електрозв'язку 
61.30 ,Діяльність у сфері супутникового електрозв'язку 
61.9 ,Інша діяльність у сфері електрозв'язку 
61.90 ,інша діяльність у сфері електрозв'язку 
62 ,"Комп'ютерне програмування, консультування та пов'язана з ними діяльність "
62.0 ,"Комп'ютерне програмування, консультування та пов'язана з ними діяльність "
62.01 ,Комп'ютерне програмування 
62.02 ,Консультування з питань інформатизації 
62.03 ,Діяльність із керування комп'ютерним устаткованням 
62.09 ,Інша діяльність у сфері інформаційних технологій і комп'ютерних систем 
63 ,Надання інформаційних послуг 
63.1 ,"Оброблення даних, розміщення інформації на веб-вузлах і пов'язана з ними діяльність; веб-портали "
63.11 ,"Оброблення даних, розміщення інформації на веб-вузлах і пов'язана з ними діяльність "
63.12 ,Веб-портали 
63.9 ,Надання інших інформаційних послуг 
63.91 ,Діяльність інформаційних агентств 
63.99 ,"Надання інших інформаційних послуг, н. в. і. у. "
K ,ФІНАНСОВА ТА СТРАХОВА ДІЯЛЬНІСТЬ 
64 ,"Надання фінансових послуг, крім страхування та пенсійного забезпечення "
64.1 ,Грошове посередництво 
64.11 ,Діяльність центрального банку 
64.19 ,Інші види грошового посередництва 
64.2 ,Діяльність холдингових компаній 
64.20 ,Діяльність холдингових компаній 
64.3 ,"Трасти, фонди та подібні фінансові суб'єкти "
64.30 ,"Трасти, фонди та подібні фінансові суб'єкти "
64.9 ,"Надання інших фінансових послуг, крім страхування та пенсійного забезпечення "
64.91 ,Фінансовий лізинг 
64.92 ,Інші види кредитування 
64.99 ,"Надання інших фінансових послуг (крім страхування та пенсійного забезпечення), н. в. і. у. "
65 ,"Страхування, перестрахування та недержавне пенсійне забезпечення, крім обов'язкового соціального страхування "
65.1 ,Страхування 
65.11 ,Страхування життя 
65.12 ,"Інші види страхування, крім страхування життя "
65.2 ,Перестрахування 
65.20 ,Перестрахування 
65.3 ,Недержавне пенсійне забезпечення 
65.30 ,Недержавне пенсійне забезпечення 
66 ,Допоміжна діяльність у сферах фінансових послуг і страхування 
66.1 ,"Допоміжна діяльність у сфері фінансових послуг, крім страхування та пенсійного забезпечення "
66.11 ,Управління фінансовими ринками 
66.12 ,Посередництво за договорами по цінних паперах або товарах 
66.19 ,"Інша допоміжна діяльність у сфері фінансових послуг, крім страхування та пенсійного забезпечення "
66.2 ,Допоміжна діяльність у сфері страхування та пенсійного забезпечення 
66.21 ,Оцінювання ризиків та завданої шкоди 
66.22 ,Діяльність страхових агентів і брокерів 
66.29 ,Інша допоміжна діяльність у сфері страхування та пенсійного забезпечення 
66.3 ,Управління фондами 
66.30 ,Управління фондами 
L ,ОПЕРАЦІЇ З НЕРУХОМИМ МАЙНОМ 
