code,name
68 ,Операції з нерухомим майном 
68.1 ,Купівля та продаж власного нерухомого майна 
68.10 ,Купівля та продаж власного нерухомого майна 
68.2 ,Надання в оренду й експлуатацію власного чи орендованого нерухомого майна 
68.20 ,Надання в оренду й експлуатацію власного чи орендованого нерухомого майна 
68.3 ,Операції з нерухомим майном за винагороду або на основі контракту 
68.31 ,Агентства нерухомості 
68.32 ,Управління нерухомим майном за винагороду або на основі контракту 
M ,"ПРОФЕСІЙНА, НАУКОВА ТА ТЕХНІЧНА ДІЯЛЬНІСТЬ "
69 ,Діяльність у сферах права та бухгалтерського обліку 
69.1 ,Діяльність у сфері права 
69.10 ,Діяльність у сфері права 
69.2 ,Діяльність у сфері бухгалтерського обліку й аудиту; консультування з питань оподаткування 
69.20 ,Діяльність у сфері бухгалтерського обліку й аудиту; консультування з питань оподаткування 
70 ,Діяльність головних управлінь (хед-офісів); консультування з питань керування 
70.1 ,Діяльність головних управлінь (хед-офісів) 
70.10 ,Діяльність головних управлінь (хед-офісів) 
70.2 ,Консультування з питань керування 
70.21 ,Діяльність у сфері зв'язків із громадськістю 
70.22 ,Консультування з питань комерційної діяльності й керування 
71 ,Діяльність у сферах архітектури та інжинірингу; технічні випробування та дослідження 
71.1 ,"Діяльність у сферах архітектури та інжинірингу, надання послуг технічного консультування "
71.11 ,Діяльність у сфері архітектури 
71.12 ,"Діяльність у сфері інжинірингу, геології та геодезії, надання послуг технічного консультування в цих сферах "
71.2 ,Технічні випробування та дослідження 
71.20 ,Технічні випробування та дослідження 
72 ,Наукові дослідження та розробки 
72.1 ,Дослідження й експериментальні розробки у сфері природничих і технічних наук 
72.11 ,Дослідження й експериментальні розробки у сфері біотехнологій 
72.19 ,Дослідження й експериментальні розробки у сфері інших природничих і технічних наук 
72.2 ,Дослідження й експериментальні розробки у сфері суспільних і гуманітарних наук 
72.20 ,Дослідження й експериментальні розробки у сфері суспільних і гуманітарних наук 
73 ,Рекламна діяльність і дослідження кон'юнктури ринку 
73.1 ,Рекламна діяльність 
73.11 ,Рекламні агентства 
73.12 ,Посередництво в розміщенні реклами в засобах масової інформації 
73.2 ,Дослідження кон'юнктури ринку та виявлення громадської думки 
73.20 ,Дослідження кон'юнктури ринку та виявлення громадської думки 
74 ,"Інша професійна, наукова та технічна діяльність "
74.1 ,Спеціалізована діяльність із дизайну 
74.10 ,Спеціалізована діяльність із дизайну 
74.2 ,Діяльність у сфері фотографії 
74.20 ,Діяльність у сфері фотографії 
74.3 ,Надання послуг перекладу 
74.30 ,Надання послуг перекладу 
74.9 ,"Інша професійна, наукова та технічна діяльність, н. в. і. у. "
74.90 ,"Інша професійна, наукова та технічна діяльність, н. в. і. у. "
75 ,Ветеринарна діяльність 
75.0 ,Ветеринарна діяльність 
75.00 ,Ветеринарна діяльність 
N ,ДІЯЛЬНІСТЬ У СФЕРІ АДМІНІСТРАТИВНОГО ТА ДОПОМІЖНОГО ОБСЛУГОВУВАННЯ 
77 ,"Оренда, прокат і лізинг "
77.1 ,Надання в оренду автотранспортних засобів 
77.11 ,Надання в оренду автомобілів і легкових автотранспортних засобів 
77.12 ,Надання в оренду вантажних автомобілів 
77.2 ,Прокат побутових виробів і предметів особистого вжитку 
77.21 ,Прокат товарів для спорту та відпочинку 
77.22 ,Прокат відеозаписів і дисків 
77.29 ,Прокат інших побутових виробів і предметів особистого вжитку 
77.3 ,"Надання в оренду інших машин, устатковання та товарів "
77.31 ,Надання в оренду сільськогосподарських машин і устатковання 
77.32 ,Надання в оренду будівельних машин і устатковання 
77.33 ,"Надання в оренду офісних машин і устатковання, у тому числі комп'ютерів "
77.34 ,Надання в оренду водних транспортних засобів 
77.35 ,Надання в оренду повітряних транспортних засобів 
77.39 ,"Надання в оренду інших машин, устатковання та товарів. н. в. і. у. "
77.4 ,"Лізинг інтелектуальної власності та подібних продуктів, крім творів, захищених авторськими правами "
77.40 ,"Лізинг інтелектуальної власності та подібних продуктів, крім творів, захищених авторськими правами "
78 ,Діяльність із працевлаштування 
78.1 ,Діяльність агентств працевлаштування 
78.10 ,Діяльність агентств працевлаштування 
78.2 ,Діяльність агентств тимчасового працевлаштування 
78.20 ,Діяльність агентств тимчасового працевлаштування 
78.3 ,Інша діяльність із забезпечення трудовими ресурсами 
78.30 ,Інша діяльність із забезпечення трудовими ресурсами 
79 ,"Діяльність туристичних агентств, туристичних операторів, надання інших послуг бронювання та пов'язана з цим діяльність "
79.1 ,Діяльність туристичних агентств і туристичних операторів 
79.11 ,Діяльність туристичних агентств 
79.12 ,Діяльність туристичних операторів 
79.9 ,Надання інших послуг бронювання та пов'язана з цим діяльність 
79.90 ,Надання інших послуг бронювання та пов'язана з цим діяльність 
80 ,Діяльність охоронних служб та проведення розслідувань 
80.1 ,Діяльність приватних охоронних служб 
80.10 ,Діяльність приватних охоронних служб 
80.2 ,Обслуговування систем безпеки 
80.20 ,Обслуговування систем безпеки 
80.3 ,Проведення розслідувань 
80.30 ,Проведення розслідувань 
81 ,Обслуговування будинків і територій 
81.1 ,Комплексне обслуговування об'єктів 
81.10 ,Комплексне обслуговування об'єктів 
81.2 ,Діяльність із прибирання 
81.21 ,Загальне прибирання будинків 
81.22 ,Інша діяльність із прибирання будинків і промислових об'єктів 
81.29 ,Інші види діяльності із прибирання 
81.3 ,Надання ландшафтних послуг 
81.30 ,Надання ландшафтних послуг 
82 ,"Адміністративна та допоміжна офісна діяльність, інші допоміжні комерційні послуги "
82.1 ,Адміністративна та допоміжна офісна діяльність 
82.11 ,Надання комбінованих офісних адміністративних послуг 
82.19 ,"Фотокопіювання, підготування документів та інша спеціалізована допоміжна офісна діяльність "
82.2 ,Діяльність телефонних центрів 
82.20 ,Діяльність телефонних центрів 
82.3 ,Організування конгресів і торговельних виставок 
82.30 ,Організування конгресів і торговельних виставок 
82.9 ,"Надання допоміжних комерційних послуг, н. в. і. у. "
82.91 ,Діяльність агентств зі стягування платежів і бюро кредитних історій 
82.92 ,Пакування 
82.99 ,"Надання інших допоміжних комерційних послуг, н. в. і. у. "
O ,ДЕРЖАВНЕ УПРАВЛІННЯ Й ОБОРОНА; ОБОВ'ЯЗКОВЕ СОЦІАЛЬНЕ СТРАХУВАННЯ 
84 ,Державне управління й оборона; обов'язкове соціальне страхування 
84.1 ,Державне управління загального характеру; соціально-економічне управління 
84.11 ,Державне управління загального характеру 
84.12 ,"Регулювання у сферах охорони здоров'я, освіти, культури та інших соціальних сферах, крім обов'язкового соціального страхування "
84.13 ,Регулювання та сприяння ефективному веденню економічної діяльності 
84.2 ,Надання державних послуг суспільству в цілому 
84.21 ,Міжнародна діяльність 
84.22 ,Діяльність у сфері оборони 
84.23 ,Діяльність у сфері юстиції та правосуддя 
84.24 ,Діяльність у сфері охорони громадського порядку та безпеки 
84.25 ,Діяльність пожежних служб 
84.3 ,Діяльність у сфері обов'язкового соціального страхування 
84.30 ,Діяльність у сфері обов'язкового соціального страхування 
P ,ОСВІТА 
85 ,Освіта 
85.1 ,Дошкільна освіта 
85.10 ,Дошкільна освіта 
85.2 ,Початкова освіта 
85.20 ,Початкова освіта 
85.3 ,Середня освіта 
85.31 ,Загальна середня освіта 
85.32 ,Професійно-технічна освіта
85.4 ,Вища освіта 
85.41 ,Професійно-технічна освіта на рівні вищого професійно-технічного навчального закладу 
85.42 ,Вища освіта 
85.5 ,Інші види освіти 
85.51 ,Освіта у сфері спорту та відпочинку 
85.52 ,Освіта у сфері культури 
85.53 ,Діяльність шкіл підготовлення водіїв транспортних засобів 
85.59 ,"Інші види освіти, н. в. і. у. "
85.6 ,Допоміжна діяльність у сфері освіти 
85.60 ,Допоміжна діяльність у сфері освіти 
Q ,ОХОРОНА ЗДОРОВ'Я ТА НАДАННЯ СОЦІАЛЬНОЇ ДОПОМОГИ 
86 ,Охорона здоров'я 
86.1 ,Діяльність лікарняних закладів 
86.10 ,Діяльність лікарняних закладів 
86.2 ,Медична та стоматологічна практика 
86.21 ,Загальна медична практика 
86.22 ,Спеціалізована медична практика 
86.23 ,Стоматологічна практика 
86.9 ,Інша діяльність у сфері охорони здоров'я 
86.90 ,Інша діяльність у сфері охорони здоров'я 
87 ,Надання послуг догляду із забезпеченням проживання 
87.1 ,Діяльність із догляду за хворими із забезпеченням проживання 
87.10 ,Діяльність із догляду за хворими із забезпеченням проживання 
87.2 ,Надання послуг догляду із забезпеченням проживання для осіб з розумовими вадами та хворих на наркоманію 
87.20 ,Надання послуг догляду із забезпеченням проживання для осіб з розумовими вадами та хворих на наркоманію 
87.3 ,Надання послуг догляду із забезпеченням проживання для осіб похилого віку та інвалідів 
87.30 ,Надання послуг щодо догляду із забезпеченням проживання для осіб похилого віку та інвалідів 
87.9 ,Надання інших послуг догляду із забезпеченням проживання 
87.90 ,Надання інших послуг догляду із забезпеченням проживання 
88 ,Надання соціальної допомоги без забезпечення проживання 
88.1 ,Надання соціальної допомоги без забезпечення проживання для осіб похилого віку та інвалідів 
88.10 ,Надання соціальної допомоги без забезпечення проживання для осіб похилого віку та інвалідів 
88.9 ,Надання іншої соціальної допомоги без забезпечення проживання 
88.91 ,Денний догляд за дітьми 
88.99 ,"Надання іншої соціальної допомоги без забезпечення проживання, н. в. і. у. "
R ,"МИСТЕЦТВО, СПОРТ, РОЗВАГИ ТА ВІДПОЧИНОК "
90 ,"Діяльність у сфері творчості, мистецтва та розваг "
90.0 ,"Діяльність у сфері творчості, мистецтва та розваг "
90.01 ,Театральна та концертна діяльність 
90.02 ,Діяльність щодо підтримання театральних і концертних заходів 
90.03 ,Індивідуальна мистецька діяльність 
90.04 ,Функціювання театральних і концертних залів 
91 ,"Функціювання бібліотек, архівів, музеїв та інших закладів культури "
91.0 ,"Функціювання бібліотек, архівів, музеїв та інших закладів культури "
91.01 ,Функціювання бібліотек і архівів 
91.02 ,Функціювання музеїв 
91.03 ,"Діяльність із охорони та використання пам'яток історії, будівель та інших пам'яток культури "
91.04 ,"Функціювання ботанічних садів, зоопарків і природних заповідників "
92 ,Організування азартних ігор 
92.0 ,Організування азартних ігор 
92.00 ,Організування азартних ігор 
93 ,"Діяльність у сфері спорту, організування відпочинку та розваг "
93.1 ,Діяльність у сфері спорту 
93.11 ,Функціювання спортивних споруд 
93.12 ,Діяльність спортивних клубів 
93.13 ,Діяльність фітнес-центрів 
93.19 ,Інша діяльність у сфері спорту 
93.2 ,Організування відпочинку та розваг 
93.21 ,Функціювання атракціонів і тематичних парків 
93.29 ,Організування інших видів відпочинку та розваг 
S ,НАДАННЯ ІНШИХ ВИДІВ ПОСЛУГ 
94 ,Діяльність громадських організацій 
94.1 ,"Діяльність організацій промисловців і підприємців, професійних організацій "
94.11 ,Діяльність організацій промисловців і підприємців 
94.12 ,Діяльність професійних громадських організацій 
94.2 ,Діяльність професійних спілок 
94.20 ,Діяльність професійних спілок 
94.9 ,Діяльність інших громадських організацій 
94.91 ,Діяльність релігійних організацій 
94.92 ,Діяльність політичних організацій 
94.99 ,"Діяльність інших громадських організацій, н. в. і. у. "
95 ,"Ремонт комп'ютерів, побутових виробів і предметів особистого вжитку "
95.1 ,Ремонт комп'ютерів і обладнання зв'язку 
95.11 ,Ремонт комп'ютерів і периферійного устатковання 
95.12 ,Ремонт обладнання зв'язку 
95.2 ,Ремонт побутових виробів і предметів особистого вжитку 
95.21 ,"Ремонт електронної апаратури побутового призначення для приймання, записування, відтворення звуку й зображення "
95.22 ,"Ремонт побутових приладів, домашнього та садового обладнання "
95.23 ,Ремонт взуття та шкіряних виробів 
95.24 ,Ремонт меблів і домашнього начиння 
95.25 ,Ремонт годинників і ювелірних виробів 
95.29 ,Ремонт інших побутових виробів і предметів особистого вжитку 
96 ,Надання інших індивідуальних послуг 
96.0 ,Надання інших індивідуальних послуг 
96.01 ,Прання та хімічне чищення текстильних і хутряних виробів 
96.02 ,Надання послуг перукарнями та салонами краси 
96.03 ,Організування поховань і надання суміжних послуг 
96.04 ,Діяльність із забезпечення фізичного комфорту 
96.09 ,"Надання інших індивідуальних послуг, н. в. і. у. "
T ,ДІЯЛЬНІСТЬ ДОМАШНІХ ГОСПОДАРСТВ 
97 ,Діяльність домашніх господарств як роботодавців для домашньої прислуги 
97.0 ,Діяльність домашніх господарств як роботодавців для домашньої прислуги 
97.00 ,Діяльність домашніх господарств як роботодавців для домашньої прислуги 
98 ,Діяльність домашніх господарств як виробників товарів та послуг для власного споживання 
98.1 ,Діяльність домашніх господарств як виробників товарів для власного споживання 
98.10 ,Діяльність домашніх господарств як виробників товарів для власного споживання 
98.2 ,Діяльність домашніх господарств як виробників послуг для власного споживання 
98.20 ,Діяльність домашніх господарств як виробників послуг для власного споживання 
U ,ДІЯЛЬНІСТЬ ЕКСТЕРИТОРІАЛЬНИХ ОРГАНІЗАЦІЙ І ОРГАНІВ 
99 ,Діяльність екстериторіальних організацій і органів 
99.0 ,Діяльність екстериторіальних організацій і органів 
99.00 ,Діяльність екстериторіальних організацій і органів 
